{
  "version": "4.15.1",
  "appVersion": "1.15.1",
  "artifact": {
    "type": "helm-http",
    "repository": "ingress-nginx",
    "name": "ingress-nginx",
    "version": "4.15.1",
    "digest": "sha256:3eff0bd18151d6e6b1c441463410571443dda1ac78292cb189346628de784f0c"
  },
  "identities": {
    "chartDigest": "sha256:3eff0bd18151d6e6b1c441463410571443dda1ac78292cb189346628de784f0c"
  },
  "available": true,
  "recommended": true,
  "supportTier": "upstream",
  "compatibility": {
    "kubernetes": ">=1.31.0 <1.36.0"
  },
  "configuration": {
    "schema": {
      "type": "object",
      "properties": {
        "controller": {
          "type": "object",
          "properties": {
            "replicaCount": {
              "type": "integer",
              "default": 1,
              "title": "Controller replicas",
              "minimum": 0
            },
            "autoscaling": {
              "type": "object",
              "properties": {
                "enabled": {
                  "type": "boolean",
                  "default": false
                },
                "annotations": {
                  "type": "object",
                  "properties": {}
                },
                "minReplicas": {
                  "type": "integer",
                  "default": 1
                },
                "maxReplicas": {
                  "type": "integer",
                  "default": 11
                },
                "targetCPUUtilizationPercentage": {
                  "type": "integer",
                  "default": 50
                },
                "targetMemoryUtilizationPercentage": {
                  "type": "integer",
                  "default": 50
                },
                "behavior": {
                  "type": "object",
                  "properties": {}
                }
              },
              "title": "Autoscaling"
            },
            "service": {
              "type": "object",
              "properties": {
                "type": {
                  "type": "string",
                  "default": "LoadBalancer",
                  "title": "Service type"
                },
                "externalTrafficPolicy": {
                  "type": "string",
                  "default": "",
                  "title": "External traffic policy"
                }
              }
            },
            "ingressClassResource": {
              "type": "object",
              "properties": {
                "name": {
                  "type": "string",
                  "default": "nginx"
                },
                "enabled": {
                  "type": "boolean",
                  "default": true
                },
                "default": {
                  "type": "boolean",
                  "default": false
                },
                "annotations": {
                  "type": "object",
                  "properties": {}
                },
                "controllerValue": {
                  "type": "string",
                  "default": "k8s.io/ingress-nginx"
                },
                "aliases": {
                  "type": "array",
                  "items": {
                    "type": "string"
                  },
                  "default": []
                },
                "parameters": {
                  "type": "object",
                  "properties": {}
                }
              },
              "title": "IngressClass"
            },
            "hostPort": {
              "type": "object",
              "properties": {
                "enabled": {
                  "type": "boolean",
                  "default": false,
                  "title": "Bind host ports"
                }
              }
            },
            "metrics": {
              "type": "object",
              "properties": {
                "enabled": {
                  "type": "boolean",
                  "default": false,
                  "title": "Expose metrics"
                }
              }
            },
            "resources": {
              "type": "object",
              "properties": {
                "requests": {
                  "type": "object",
                  "title": "Requests",
                  "properties": {
                    "cpu": {
                      "type": "string",
                      "title": "CPU request",
                      "pattern": "^([0-9]+(\\.[0-9]+)?([EPTGMK]i?|m)?|)$"
                    },
                    "memory": {
                      "type": "string",
                      "title": "Memory request",
                      "pattern": "^([0-9]+(\\.[0-9]+)?([EPTGMK]i?|m)?|)$"
                    }
                  }
                },
                "limits": {
                  "type": "object",
                  "title": "Limits",
                  "properties": {
                    "cpu": {
                      "type": "string",
                      "title": "CPU limit",
                      "pattern": "^([0-9]+(\\.[0-9]+)?([EPTGMK]i?|m)?|)$"
                    },
                    "memory": {
                      "type": "string",
                      "title": "Memory limit",
                      "pattern": "^([0-9]+(\\.[0-9]+)?([EPTGMK]i?|m)?|)$"
                    }
                  }
                }
              },
              "title": "Controller resources"
            }
          }
        }
      }
    },
    "presets": [
      {
        "id": "upstream",
        "label": "Upstream defaults",
        "description": "Start with the exact chart defaults; configure storage, exposure and secret references for your cluster.",
        "values": {}
      }
    ],
    "defaultPreset": "upstream",
    "namespace": "astronomer-ingress-nginx"
  }
}
